;word
2918;количество человек, которым оказаны социальные услуги в области спорта за 2016 г.
2919;количество человек, которым оказаны социальные услуги по 2016 г.
2920;количество человек, которым оказаны социальные услуги с 2017 г.
2921;количество человек, получивших благотворительную помощь в денежной форме по 2016 г.
2922;количество человек, получивших благотворительную помощь в денежной форме с 2017 г.
2923;количество человек, получивших благотворительную помощь в натуральной форме, за исключением оказания социальных услуг и юридической помощи на безвозмездной или льготной основе с 2017 г.
2924;количество человек, получивших благотворительную помощь в натуральной форме, за исключением оказания социальных услуг и юридической помощи на безвозмездной или на льготной основе по 2016 г.
2925;количество человек, получивших юридическую помощь на безвозмездной или на льготной основе по 2016 г.
2926;количество человек, получивших юридическую помощь на безвозмездной или на льготной основе с 2017 г.
2927;количество человек, принявших участие в мероприятиях, проводимых организацией по 2016 г.
2928;общий объем поступивших денежных средств и имущества по 2016 г.
2929;объем иных поступлений денежных средств и имущества по 2016 г.
2930;объем предоставленных пожертвований, грантов некоммерческим организациям по 2016 г.
2931;объем предоставленных пожертвований, грантов социально ориентированным некоммерческим организациям по 2016 г.
2932;оплата труда и страховые взносы в государственные внебюджетные фонды за 2016 г.
2933;поступление денежных средств и иного имущества
2934;поступления от иностранных государств, их государственных органов, международных и иностранных организаций по 2016 г.
2935;поступления от иностранных граждан и лиц без гражданства по 2016 г.
2936;распределение социально ориентированных некоммерческих организаций по видам деятельности
2937;распределение социально ориентированных некоммерческих организаций по наличию помещения
2938;расходы на оказание благотворительной и иной помощи в натуральной форме за 2016 г.
2939;расходы на оказание благотворительной и иной помощи за 2016 г.
2940;расходы на осуществление предпринимательской деятельности по 2016 г.
2941;расходы на приобретение земельных участков за 2016 г.
2942;расходы на приобретение основных средств, земельных участков, строительство и реконструкцию зданий, строений, сооружений по 2016 г.
2943;среднесписочная численность работников (за исключением внешних совместителей) 
2944;средняя  численность внешних совместителей
2945;средняя численность добровольцев (волонтеров)
2946;средняя численность нештатных работников (привлеченных по договорам гражданско-правового характера)
2947;текущие расходы на содержание организации и ведение ею уставной деятельности по 2016 г.
2948;темп роста количества социально ориентированных некоммерческих организаций за 2016 г.
2949;темп роста количества социально ориентированных некоммерческих организаций с 2017 г.
2950;целевые поступления (включая пожертвования) от российских коммерческих организаций,  за исключением дохода от целевого капитала, на оказание социальных услуг за 2016 г.
2951;целевые поступления (включая пожертвования) от российских коммерческих организаций, денежные средства, недвижимое  имущество, ценные бумаги полученные на формирование или пополнение целевого капитала, за исключением дохода от целевого капитала по 2016 г.
2952;целевые поступления (включая пожертвования) от российских коммерческих организаций, за исключением дохода от целевого капитала по 2016 г.
2953;целевые поступления (включая пожертвования), гранты от российских некоммерческих организаций, денежные средства, недвижимое имущество, ценные бумаги, полученные на формирование или пополнение целевого капитала, за исключением грантов от некоммерческих неправительственных организаций, участвующих в развитии институтов гражданского общества (предоставленных за счет субсидий из федерального бюджета) по 2016 г.
2954;целевые поступления (включая пожертвования), гранты от российских некоммерческих организаций, за исключением грантов от некоммерческих неправительственных организаций, участвующих в развитии институтов гражданского общества (предоставленных за счет субсидий из федерального бюджета) по 2016 г.
2955;целевые поступления (включая пожертвования), гранты от российских некоммерческих организаций, за исключением грантов от некоммерческих неправительственных организаций, участвующих в развитии институтов гражданского общества, предоставленных за счет субсидий из федерального бюджета, на оказание социальных услуг за 2016 г.
2956;целевые поступления (включая пожертвования), гранты от российских физических лиц, денежные средства, недвижимое имущество, ценные бумаги, полученные на формирование или пополнение целевого капитала (за исключением полученных по завещанию в порядке наследования) по 2016 г.
2957;целевые поступления (включая пожертвования), гранты от российских физических лиц, за исключением денежных средств и иного имущества, полученного по завещанию в порядке наследования по 2016 г.
2958;целевые поступления (включая пожертвования), гранты от российских физических лиц, за исключением денежных средств и иного имущества, полученного по завещанию в порядке наследования, на оказание социальных услуг за 2016 г.
2959;целевые поступления из бюджетов государственных внебюджетных фондов на оказание социальных услуг за 2016 г.
2960;целевые поступления из бюджетов государственных внебюджетных фондов по 2016 г.
2961;целевые поступления из бюджетов субъектов российской федерации на оказание социальных услуг за 2016 г.
2962;целевые поступления из бюджетов субъектов российской федерации по 2016 г.
2963;целевые поступления из муниципальных (местных) бюджетов на оказание социальных услуг за 2016 г.
2964;целевые поступления из муниципальных (местных) бюджетов по 2016 г.
2965;целевые поступления из федерального бюджета на оказание социальных услуг за 2016 г.
2966;целевые поступления из федерального бюджета по 2016 г.
2967;использование денежных средств и иного имущества религиозной организацией
2968;поступление денежных средств и иного имущества в религиозную организацию
2969;распределение количества религиозных организаций по видам деятельности согласно учредительным документам
2970;дефицит (-), профицит (+) местного бюджета
2971;доходы местного бюджета на текущий год
2972;муниципальные банки и иные финансовые организации
2973;муниципальные образовательные организации
2974;муниципальные организации здравоохранения
2975;муниципальные организации культуры
2976;муниципальные организации спорта
2977;муниципальные унитарные предприятия
2978;наличие муниципальных образований
2979;обособленные подразделения муниципальных образовательных организаций
2980;обособленные подразделения муниципальных организаций здравоохранения
2981;обособленные подразделения муниципальных организаций культуры
2982;обособленные подразделения муниципальных организаций спорта
2983;расходы местного бюджета на текущий год
2984;число муниципальных образований, участвующих в межмуниципальных коммерческих организациях
2985;число муниципальных образований, участвующих на добровольной основе в объединениях муниципальных образований, в межмуниципальных некоммерческих организациях
2986;объем социальных выплат населению и налогооблагаемых денежных доходов населения
2987;импорт товаров из республики белоруссия
2988;'цифровая зрелость' органов государственной власти субъектов российской федерации, органов местного самоуправления и организаций в сфере здравоохранения, образования, городского хозяйства и строительства, общественного транспорта, подразумевающая использование ими отечественных информационно-технологических решений
2989;динамика валового регионального продукта на душу населения
2990;динамика реальной среднемесячной начисленной заработной платы
2991;доля ветхого и аварийного жилищного фонда в общем объеме жилищного фонда субъекта российской федерации
2992;доля городов с благоприятной городской средой
2993;доля граждан, занимающихся добровольческой (волонтерской) деятельностью
2994;доля граждан, систематически занимающихся физической культурой и спортом
2995;доля доходов от реализации услуг по основному виду деятельности убыточных организаций коммунального комплекса в общем объеме доходов от реализации услуг по основному виду деятельности организаций коммунального комплекса в субъекте российской федерации
2996;доля многодетных семей, получивших жилые помещения и улучшивших жилищные условия в отчетном году, в общем числе многодетных семей, состоящих на учете в качестве нуждающихся в жилых помещениях
2997;доля многоквартирных домов в целом по субъекту российской федерации, в которых собственники помещений выбрали и реализуют управление многоквартирными домами посредством товариществ собственников жилья либо жилищных кооперативов или иного специализированного потребительского кооператива
2998;доля молодых семей, получивших жилые помещения и улучшивших жилищные условия в отчетном году, в общем числе молодых семей, состоящих на учете в качестве нуждающихся в жилых помещениях
2999;доля муниципальных образований, в которых предоставление установленных федеральными законами и законами субъектов российской федерации мер социальной поддержки гражданам на оплату жилого помещения и коммунальных услуг (за исключением субсидий гражданам на оплату жилого помещения и коммунальных услуг) осуществляется в денежной форме (в том числе путем перечисления средств на предоставление таких мер через банковские счета в банках, организации связи или иным способом)
3000;доля населения с денежными доходами ниже величины прожиточного минимума, установленной в субъекте российской федерации
3001;доля площади жилищного фонда, обеспеченного всеми видами благоустройства, в общей площади жилищного фонда субъекта российской федерации
3002;доля преподавателей государственных образовательных учреждений среднего профессионального образования субъекта российской федерации со стажем работы до 5 лет в общей численности преподавателей государственных образовательных учреждений среднего профессионального образования субъекта российской федерации
3003;доля продукции высокотехнологичных и наукоемких отраслей в валовом региональном продукте субъекта российской федерации
3004;доля продукции, произведенной малыми предприятиями, в общем объеме валового регионального продукта
3005;доля протяженности автомобильных дорог общего пользования местного значения, не отвечающих нормативным требованиям, в общей протяженности автомобильных дорог общего пользования местного значения
3006;доля семей, получающих жилищные субсидии на оплату жилого помещения и коммунальных услуг, в общем числе семей в субъекте российской федерации
3007;доля среднесписочной численности работников (без внешних совместителей) малых и средних предприятий в среднесписочной численности работников (без внешних совместителей) всех предприятий и организаций
3008;доля убыточных организаций жилищно-коммунального хозяйства
3009;доля утечек и неучтенного расхода воды в общем объеме поданной воды
3010;доля энергетических ресурсов, производимых с использованием возобновляемых источников энергии, в общем объеме энергетических ресурсов, производимых на территории субъекта российской федерации
3011;естественный прирост населения
3012;индекс производительности труда
3013;качество городской среды
3014;качество окружающей среды
3015;количество высокопроизводительных рабочих мест во внебюджетном секторе экономики
3016;количество государственных образовательных учреждений среднего профессионального образования субъекта российской федерации
3017;количество государственных образовательных учреждений среднего профессионального образования субъекта российской федерации, здания которых находятся в аварийном состоянии или требуют капитального ремонта
3018;количество государственных унитарных и казенных предприятий в субъекте российской федерации
3019;количество дней с нарушением снабжения водой, тепловой и электрической энергией в среднем на одного жителя
3020;количество жилых помещений (квартир) в расчете на 1 тыс. человек населения, в том числе введенных в действие за год
3021;количество малых и средних предприятий в расчете на 1 тыс. человек населения субъекта российской федерации
3022;количество муниципальных унитарных и казенных предприятий в субъекте российской федерации
3023;"количество субъектов хозяйственной и иной деятельности с установленными нормативами предельно допустимых выбросов вредных (загрязняющих) веществ в атмосферный воздух, расположенных на территории субъекта российской федерации и подлежащих федеральному статистическому наблюдению по форме №2-тп (воздух) ""сведения об охране атмосферного воздуха"""
3024;количество унитарных и казенных предприятий в субъекте российской федерации
3025;коэффициент доступности жилья
3026;коэффициент миграционного прироста (на 10 тыс. человек)
3027;коэффициент напряженности на рынке труда
3028;материнская смертность на 100000 родившихся живыми
3029;обеспеченность детей дошкольного возраста местами в дошкольных образовательных учреждениях
3030;оборот продукции (услуг), производимой малыми предприятиями,  в том числе микропредприятиями и индивидуальными  предпринимателями
3031;общая площадь жилых помещений, приходящаяся в среднем на 1 жителя субъекта российской федерации
3032;общая площадь жилья, введенного в эксплуатацию, построенного за счет средств бюджета субъекта российской федерации на территории такого субъекта российской федерации, а также на территории другого субъекта российской федерации, приходящаяся в среднем на одного жителя субъекта российской федерации
3033;"общее количество субъектов хозяйственной и иной деятельности, расположенных на территории субъекта российской федерации и подлежащих федеральному статистическому наблюдению по форме №2-тп (воздух) ""сведения об охране атмосферного воздуха"""
3034;объем выбросов вредных (загрязняющих) веществ в атмосферный воздух от стационарных источников, расположенных на территории субъекта российской федерации
3035;объем инвестиций в основной капитал (за исключением бюджетных средств)
3036;объем инвестиций в основной капитал (кроме бюджетных средств федерального бюджета, инвестиций в добывающие отрасли) на душу населения
3037;объем инвестиций в основной капитал, за исключением бюджетных средств, в расчете на  1 человека
