;word
1568;число часов, потерянных из-за аварий, ликвидированных в отчетном году, в бурении
1569;число часов, потерянных из-за аварий, происшедших в бурении
1570;эксплуатационный фонд нефтяных скважин 
1571;эксплуатационный фонд нефтяных скважин на начало года установки
1572;эксплуатационный фонд нефтяных скважин – телемеханизированные на конец отчетного года
1573;выпуск продукции или  количество переработанного сырья в отчетном году
1574;мощность на начало года, следующего за отчетным,  в номенклатуре и ассортименте продукции отчетного года
1575;мощность на начало отчетного года
1576;среднегодовая мощность, действовавшая в отчетном году, с 2017 г. (в соответствии с окпд2)
1577;увеличение мощности  
1578;уменьшение мощности
1579;коэффициенты концентрации  производства по видам продукции (в соответствии с окпд2)
1580;коэффициенты концентрации производства по видам продукции (в соответствии с окпд)
1581;коэффициенты концентрации производства по видам продукции за 2009 г.
1582;"объем отгруженных товаров собственного производства, выполненных  работ, услуг собственными силами, по ""чистым"" видам деятельности по 2016 г."
1583;индекс производства по высокотехнологичным обрабатывающим видам экономической деятельности
1584;индекс производства по высокотехнологичным обрабатывающим видам экономической деятельности (оквэд2)
1585;индекс промышленного производства
1586;общий объем заказов на поставку продукции в последующие периоды по 2016 г.
1587;общий объем заказов на поставку продукции в последующие периоды с 2017 г.
1588;глубина переработки нефти
1589;доля моторных топлив экологического класса 5 в общем объеме производства
1590;производство алюминия первичного в % к предыдущему году
1591;производство меди рафинированной в % к предыдущему году
1592;производство никеля нелегированного в % к предыдущему году
1593;объем переработанной собственной нефти
1594;объем производства собственных нефтепродуктов в стоимостном выражении
1595;полная себестоимость производства 1 тонны собственных нефтепродуктов
1596;полная себестоимость производства собственных нефтепродуктов по 2017 г.
1597;полная себестоимость производства собственных нефтепродуктов с 2018 г.
1598;полная себестоимость услуг по переработке давальческой нефти 
1599;отгружено спирта этилового, алкогольной продукции, спиртосодержащих растворов собственного производства  по 2009 г .              
1600;отгружено спирта этилового, алкогольной продукции, спиртосодержащих растворов собственного производства с 2010 г. по 2016 г.
1601;производство в натуральном выражении спирта этилового, алкогольной продукции, спиртосодержащих растворов по 2009 г.
1602;производство в натуральном выражении спирта этилового, алкогольной продукции, спиртосодержащих растворов с 2010 г. по 2016 г.
1603;розлито в потребительскую тару спирта этилового, алкогольной продукции, спиртосодержащих растворов  по 2009 г.
1604;розлито в потребительскую тару спирта этилового, алкогольной продукции, спиртосодержащих растворов с 2010 г. по 2016 г.
1605;стоимость отгруженного спирта этилового, алкогольной продукции, спиртосодержащих растворов собственного производства   (с ндс и акцизом)   по 2009 г.
1606;стоимость отгруженного спирта этилового, алкогольной продукции, спиртосодержащих растворов собственного производства   (с ндс и акцизом)   с 2010 г. по 2016 г.
1607;импорт химикатов
1608;отгружено химикатов на внутренний рынок россии
1609;поставлено химикатов на экспорт
1610;поступило химикатов от других организаций россии
1611;потреблено химикатов
1612;произведено химикатов
1613;среднегодовая мощность производства (потребления) химикатов
1614;коэффициенты концентрации  производства по видам экономической деятельности с 2017 г.
1615;коэффициенты концентрации производства по видам экономической деятельности по 2016 г.
1616;индекс предпринимательской уверенности организаций обрабатывающей промышленности (без малых предприятий) с 2017 г.
1617;индекс предпринимательской уверенности организаций обрабатывающих производств (без малых предприятий) с 2009 г. по 2016 г.
1618;произведено нефтепродуктов за отчетную неделю начиная с 2017 года
1619;произведено нефтепродуктов за отчетную неделю с 2010 по 2016 гг. 
1620;выход масла растительного из семян подсолнечника в процентах от массы переработанных семян
1621;выход сахара-песка в процентах к массе переработанной свеклы
1622;выход спирта из одной тонны сырья (в переводе на условный крахмал)
1623;получено эндокринно-ферментного и специального сырья
1624;производство кожсырья
1625;извлечено полезных компонентов из попутного газа
1626;среднегодовая мощность действовавшая в отчетном году с 2010 г. по 2016 г. (в соответствии с окпд)
1627;уровень использования среднегодовой производственной мощности с 2010 г. по 2016 г. (в соответствии с окпд)
1628;уровень использования среднегодовой производственной мощности с 2017 г.  (в соответствии с окпд2)
1629;доля производства электрической энергии генерирующими объектами, функционирующими на основе использования возобновляемых источников энергии, в совокупном объеме производства электрической энергии (без учета гидроэлектростанций установленной мощностью свыше 25 мвт)
1630;доля электрической энергии, производимой с использованием возобновляемых источников энергии, в общем объеме производства электрической энергии
1631;стоимость услуг по передаче теплоэнергии
1632;стоимость услуг по передаче электроэнергии
1633;отгружено (передано) продукции в натуральном выражении в 2008-2009г.г.(в соответствии с окп)
1634;отгружено (передано) продукции в натуральном выражении с 2010 г. по 2016 г. (в соответствии с окпд)
1635;остатки продукции в натурально-вещественном исчислении на конец отчетного года с 2017 г. (в соответствии с окпд2)
1636;остатки продукции в натурально-вещественном исчислении на конец отчетного месяца с 2017 г. (оперативные данные в соответствии с окпд2)
1637;отгружено (передано) продукции в натуральном выражении с 2017 г. (годовые данные в соответствии с окпд2)
1638;остатки продукции в натурально-вещественном исчислении на конец отчетного месяца с 2010 г. по 2016 г. (в соответствии с окпд)
1639;индекс предпринимательской уверенности организаций в обеспечении электрической энергией, газом и паром, кондиционировании воздуха (без малых предприятий) с 2017 г.
1640;индекс предпринимательской уверенности организаций по производству и распределению электроэнергии, газа и воды (без малых предприятий) с 2009 г. по 2016 г.
1641;удельный расход условного топлива на отпуск электрической энергии
1642;количество строек и объектов, введенных в действие по федеральной адресной инвестиционной программе
1643;количество строек и объектов, введенных в действие по федеральной адресной инвестиционной программе (оперативные данные)
1644;количество строек и объектов, введенных в действие по федеральной адресной инвестиционной программе (оперативные данные), с 2017 г.
1645;количество строек и объектов, введенных в действие по федеральной адресной инвестиционной программе, с 2017 г.
1646;количество строек и объектов, предусмотренных к вводу в действие по федеральной адресной инвестиционной программе
1647;количество строек и объектов, предусмотренных к вводу в действие по федеральной адресной инвестиционной программе (оперативные данные)
1648;количество строек и объектов, предусмотренных к вводу в действие по федеральной адресной инвестиционной программе (оперативные данные), с 2017 г. 
1649;количество строек и объектов, предусмотренных к вводу в действие по федеральной адресной инвестиционной программе, с 2017 г. 
1650;лимит бюджетных ассигнований на капитальные вложения на год
1651;лимит бюджетных ассигнований на капитальные вложения на год (оперативные данные)
1652;лимит бюджетных ассигнований на капитальные вложения на год (оперативные данные), с 2017 г.
1653;лимит бюджетных ассигнований на капитальные вложения на год, с 2017 г.
1654;фактически использовано инвестиций в основной капитал по стройкам и объектам, включенным в федеральную адресную инвестиционную программу 
1655;фактически использовано инвестиций в основной капитал по стройкам и объектам, включенным в федеральную адресную инвестиционную программу (оперативные данные)
1656;фактически использовано инвестиций в основной капитал по стройкам и объектам, включенным в федеральную адресную инвестиционную программу (оперативные данные), с 2017 г.
1657;фактически использовано инвестиций в основной капитал по стройкам и объектам, включенным в федеральную адресную инвестиционную программу, с 2017 г.
1658;введено в действие мощностей и объектов по 2008 г.
1659;введено в действие мощностей и объектов с (оперативная) 2017 г.
1660;введено в действие мощностей и объектов с 2009г. по 2016г.
1661;введено в действие мощностей и объектов с 2017 г.
1662;введено в действие объектов социально-культурного назначения 
1663;введено в действие объектов социально-культурного назначения (оперативная)
1664;введено в действие общей площади жилых домов
1665;введено в действие общей площади жилых домов на 1000 человек населения
1666;введено в действие общей площади жилых домов, построенных населением (оперативные данные)
1667;введено в действие общей площади построенных населением жилых домов 
1668;годовой объем ввода жилья
1669;доля ввода жилья по стандартам экономкласса
1670;доля ввода малоэтажного жилья в общем объеме ввода жилья
1671;количество введенных жилых помещений (квартир) в расчете на 1000 человек населения
1672;количество введенных зданий построенных населением
1673;колличество введенных зданий построенных населением (оперативные данные)
1674;приобретение квартир для граждан, уволенных с военной службы, из органов внутренних дел, и приравненных к ним лиц
1675;средний размер квартир в построенных населением жилых домах
1676;средний размер построенных квартир
1677;средняя фактическая стоимость строительства одного квадратного метра общей площади жилых помещений во введенных в эксплуатацию жилых зданиях без пристроек, надстроек и встроенных помещений
1678;средняя фактическая стоимость строительства одного квадратного метра общей площади жилых помещений во введенных в эксплуатацию жилых зданиях без пристроек, надстроек и встроенных помещений (оперативные данные)
1679;удельный вес введенной общей площади жилых домов по отношению к общей площади жилищного фонда с 2018 г.
1680;введено в действие общей площади жилых домов (оперативные данные)
1681;темп роста (снижения) по вводу общей площади жилых домов
1682;количество квартир в построенных населением жилых домах
1683;количество построенных квартир
1684;количество введенных зданий
1685;общая площадь введенных зданий
1686;общая площадь введенных зданий (оперативная)
1687;общий строительный объем введенных зданий
1688;общий строительный объем введенных зданий (оперативная)
1689;количество введенных зданий (оперативная)
1690;ввод в действие природоохранных мощностей по 2008 г.
1691;ввод в действие природоохранных мощностей с 2009 г. по 2016 г.
1692;ввод в действие природоохранных мощностей с 2017 г.
1693;инвестиции в основной капитал, направленные на охрану окружающей среды и рациональное использование природных ресурсов по 2008 г.
1694;инвестиции в основной капитал, направленные на охрану окружающей среды и рациональное использование природных ресурсов с 2009 г. по 2016 г.
1695;инвестиции в основной капитал, направленные на охрану окружающей среды и рациональное использование природных ресурсов, в % к 2007 году
1696;инвестиции в основной капитал, направленные на охрану окружающей среды и рациональное использование природных ресурсов, с 2017 г.
1697;количество зданий и сооружений приостановленных или законсервированных
1698;количество зданий и сооружений, находящихся в незавершенном строительстве
1699;отношение общей площади незавершенных жилых домов к годовому вводу жилья (без индивидуальных жилых домов)
1700;площадь квартир в жилых зданиях, находящихся в незавершенном строительстве
1701;площадь квартир в жилых зданиях, находящихся в незавершенном строительстве, приостановленные или законсервированные
1702;индекс физического объема работ, выполненных по виду деятельности «строительство»,  включая работы, выполненные хозспособом,  в сопоставимых ценах 
1703;"индекс физического объема работ, выполненных по договорам строительного подряда по виду деятельности ""строительство"", в сопоставимых ценах"
1704;объем работ, выполненный собственными силами в государственном секторе экономики
1705;объем работ, выполненный собственными силами организаций без учета субъектов малого предпринимательства
1706;объем работ, выполненный собственными силами организаций по договорам строительного подряда (уточненные данные)
1707;объем работ, выполненных собственными силами, включая работы, выполненные хозспособом (уточненные данные)
1708;выбыло (списано) по износу и непригодности строительных машин
1709;индекс изменения наличия средств малой механизации, применяемых в строительстве
1710;наличие основных строительных машин
1711;наличие основных строительных машин со сроком службы, превышающим срок амортизации
1712;индекс предпринимательской уверенности в строительстве
1713;использование производственных мощностей
1714;обеспеченность строительной организации заказами
1715;обеспеченность строительной организации финансированием
1716;общая оценка экономической ситуации
1717;оценка изменения цен 
1718;оценка конкурентной среды в строительстве
1719;оценка направлений деятельности строительной организации
1720;оценка производственной деятельности организации
1721;оценка уровня портфеля заказов или планов производства
1722;оценка финансового положения строительной организации
1723;факторы, ограничивающие производственную деятельность строительных организаций
1724;запасы отдельных товаров в организациях оптовой торговли (без субъектов малого предпринимательства)
1725;запасы отдельных товаров в организациях оптовой торговли (без субъектов малого предпринимательства) с 2017 г.
1726;запасы отдельных товаров по крупным и средним организациям оптовой торговли на конец отчетного периода по 2016 г.
1727;оптовая продажа отдельных товаров организациями оптовой торговли (без субъектов малого предпринимательства) c 2017 г.
1728;оптовая продажа отдельных товаров организациями оптовой торговли (без субъектов малого предпринимательства) до 2016 г.
1729;оптовая продажа отдельных товаров по крупным и средним организациям  оптовой торговли с 2017 г.
1730;оптовая продажа отдельных товаров по крупным и средним организациям оптовой торговли по 2016 г.
1731;удельный вес продажи отдельных видов продовольственных товаров организациями оптовой торговли в ресурсах данного товара 
