;word
4017;количество детей, принимающих участие в едином уроке безопасности в информационно-телекоммуникационной сети 'интернет'
4018;количество детей, принимающих участие во всероссийской контрольной работе по информационной безопасности единого урока безопасности в информационно-телекоммуникационной сети 'интернет'
4019;количество исполнительных производств о взыскании алиментов, не оконченных на конец отчетного периода, не больше значения исполнительных производств на начало отчетного периода
4020;количество мероприятий образовательного характера в области обеспечения безопасности и развития детей в информационном пространстве, проводимых в субъектах российской федерации
4021;количество образовательных организаций, в которых организовано обучение детей основам информационной безопасности на системном уровне
4022;количество образовательных организаций, в которых проведен единый урок безопасности в информационно-телекоммуникационной сети 'интернет'
4023;количество образовательных организаций, реализующих программы общего образования, дополнительного образования детей и среднего профессионального образования, осуществляющих образовательную деятельность с использованием федеральной информационно-сервисной платформы цифровой образовательной среды
4024;количество обучающихся общеобразовательных организаций, приходящихся на одного педагога-психолога
4025;количество отечественных производителей технических средств реабилитации для детей-инвалидов, воспользовавшихся механизмами поддержки
4026;количество педагогических работников, вовлеченных в проведение единого урока безопасности в информационно-телекоммуникационной сети 'интернет'
4027;количество педагогических работников, прошедших программы повышения квалификации в области обеспечения безопасности и развития детей в информационном пространстве
4028;количество родителей (законных представителей) детей, принявших участие в мероприятиях и (или) прошедших образовательные программы в области безопасности и развития детей в информационно-телекоммуникационной сети 'интернет'
4029;количество субъектов российской федерации, разработавших и реализующих региональную программу обеспечения информационной безопасности детей, производства информационной продукции для детей и оборота информационной продукции или иной документ стратегического планирования в области обеспечения информационной безопасности детей на территории субъекта российской федерации
4030;количество субъектов российской федерации, участвующих в акции «подарок новорожденному»
4031;обеспеченность углубленным психодиагностическим обследованием вновь прибывших в учреждениях уголовно-исполнительной системы несовершеннолетних в целях выявления острых кризисных состояний, признаков психических отклонений, прогноза риска деструктивных форм поведения, в том числе склонности к суицидальному поведению в условиях изоляции
4032;охват детей неонатальным скринингом из числа новорожденных, поступивших под наблюдение медицинской организации, обследовано на фенилкетонурию, врожденный гипотиреоз, адреногенитальный синдром, галактоземию, муковисцидоз, из них выявлено больных фенилкетонурией, врожденным гипотиреозом, адреногенитальным синдромом, галактоземией, муковисцидозом
4033;охват детей профилактическими медицинскими осмотрами
4034;профилактические осмотры детей и распределение по группам здоровья детей в возрасте от 0 до 17 лет
4035;профилактические осмотры школьников и их распределение по группам здоровья
4036;распределение детей в возрасте от 3 до 6 лет по причинам непосещения дошкольной образовательной организации (в процентах к общему числу детей в соответствующем возрасте, не посещающих дошкольную образовательную организацию)
4037;расходы консолидированного бюджета субъекта российской федерации на меры социальной поддержки детей в возрасте до 18 лет из отдельных категорий семей, имеющих право на получение мер социальной поддержки
4038;"состояние здоровья новорожденных - число новорожденных, родившихся больными и заболевших, - всего, в том числе: массой тела 500 - 999 г; массой тела 1000 г и более"
4039;стационарные организации социального обслуживания для детей
4040;удельный вес объектов домов ребенка исправительных учреждений, которые полностью рассчитаны на совместное проживание осужденных матерей с детьми, в общем количестве объектов домов ребенка исправительных учреждений
4041;удельный вес численности детей с ограниченными возможностями здоровья и детей-инвалидов в общей численности обучающихся в организациях дополнительного образования
4042;численность детей, в отношении которых выявлены случаи жестокого обращения, насилия со стороны родителей (законных представителей) и лиц, совместно с ними проживающих
4043;численность детей, занимающихся в школьных спортивных клубах
4044;численность детей, родители которых лишены родительских прав (на 10 тыс. детей в возрасте от 0 до 17 лет)
4045;численность детей, родители которых ограничены в родительских правах (на 100 тыс. детей в возрасте от 0 до 17 лет)
4046;численность детей-инвалидов и детей с ограниченными возможностями здоровья 7 - 18 лет, не обучающихся в образовательных организациях
4047;численность детей-сирот и детей, оставшихся без попечения родителей, на конец года
4048;численность детей-сирот и детей, оставшихся без попечения родителей, находящихся под надзором в организациях для детей-сирот и детей, оставшихся без попечения родителей (на 10 тыс. детей в возрасте от 0 до 17 лет)
4049;число осужденных несовершеннолетних, отбывающих наказание в воспитательных колониях
4050;число решений о передаче ребенка в семью, отмененных по инициативе органа опеки и попечительства в связи с ненадлежащим выполнением усыновителями, опекунами (попечителями), приемными родителями обязанностей по воспитанию детей
4051;дефицит денежного дохода малоимущих домашних хозяйств, имеющих детей в возрасте до 18 лет
4052;доступность дошкольного образования - отношение численности детей определенной возрастной группы, посещающих организации, осуществляющие образовательную деятельность по образовательным программам дошкольного образования, к сумме указанной численности и численности детей определенной возрастной группы, не обеспеченных местом, нуждающихся в получении места в муниципальных и государственных организациях, осуществляющих образовательную деятельность по образовательным программам дошкольного образования в возрасте от 2 месяцев до 3 лет
4053;доступность дошкольного образования - отношение численности детей определенной возрастной группы, посещающих организации, осуществляющие образовательную деятельность по образовательным программам дошкольного образования, к сумме указанной численности и численности детей определенной возрастной группы, не обеспеченных местом, нуждающихся в получении места в муниципальных и государственных организациях, осуществляющих образовательную деятельность по образовательным программам дошкольного образования в возрасте от 3 до 7 лет
4054;численность детей, отдохнувших за лето в организациях отдыха детей и их оздоровления 
4055;количество детских школ искусств по видам искусств
4056;количество культурно-образовательных и музейных комплексов
4057;количество региональных и (или) муниципальных организаций отрасли культуры, по которым проведена реновация
4058;количество реконструированных и капитально отремонтированных муниципальных музеев
4059;количество созданных (реконструированных) и капитально отремонтированных объектов организаций культуры (a1)
4060;количество театров юного зрителя и театров кукол
4061;количество учреждений культурно-досугового типа в сельской местности
4062;количество федеральных организаций отрасли культуры, по которым проведена реновация
4063;количество центров культурного развития (цкр)
4064;количество детских школ искусств по видам искусств и училищ
4065;количество кинозалов, оснащённых современным оборудованием
4066;количество многофункциональных передвижных культурных центров (автоклубы)
4067;количество модельных библиотек
4068;количество организаций культуры, получивших современное оборудование (a1)
4069;количество оснащенных муниципальных музеев
4070;число обращений к цифровым ресурсам (a3)
4071;количество врученных грантов лучшим любительским творческим коллективам
4072;количество врученных стипендий творческим деятелям
4073;количество оказанной государственной поддержки лучшим работникам сельских учреждений культуры
4074;количество оказанной государственной поддержки лучшим сельским учреждениям культуры
4075;количество поддержанных творческих инициатив и проектов (a2)
4076;количество проведенных военно-исторических лагерей на территории субъектов российской федерации
4077;количество проведенных выставочных проектов федеральных и региональных музеев в субъектах российской федерации
4078;количество проведенных фестивалей детского творчества всех жанров
4079;количество реализованных всероссийских и международных творческих проектов в области музыкального, театрального и изобразительного искусства
4080;количество реализованных творческих проектов некоммерческих организаций, направленных на укрепление российской гражданской идентичности на основе духовно-нравственных и культурных ценностей народов российской федерации
4081;количество созданных памятных мест, связанных с военной историей россии
4082;число участников культурно-просветительских программ для школьников (a2)
4083;количество граждан, принимающих участие в добровольческой деятельности (a2)
4084;доля массовых социально значимых государственных и муниципальных услуг в электронном виде, предоставляемых с использованием единого портала государственных и муниципальных услуг (функций) (епгу), от общего количества таких услуг, предоставляемых в электронном виде (d6)
4085;уровень удовлетворенности качеством предоставления массовых социально значимых государственных и муниципальных услуг в электронном виде с использованием единого портала государственных и муниципальных услуг (функций) (епгу) (d6)
4086;"доля социально значимых объектов, имеющих широкополосный доступ к информационно-телекоммуникационной сети ""интернет"" в соответствии с утвержденными требованиями (d2)"
4087;доля государственных и муниципальных организаций, реализующих программы начального общего, основного общего, среднего общего и среднего профессионального образования, подключённых к единой сети передачи данных для обеспечения защищённого доступа к государственным и муниципальным информационным системам и безопасного использования информационно-телекоммуникационной сети 'интернет' (d2)
4088;доля государственных и муниципальных образовательных организаций, реализующих программы начального общего, основного общего и среднего общего образования, в помещениях которых обеспечена возможность беспроводного широкополосного доступа к информационно-телекоммуникационной сети «интернет» по технологии wi-fi
4089;количество принятых на обучение по программам высшего образования в сфере информационных технологий за счет бюджетных ассигнований федерального бюджета (нарастающим итогом, начиная с 2021 года)
4090;количество граждан, прошедших обучение по дополнительным образовательным программам с использованием мер государственной поддержки для получения новых и востребованных на рынке труда цифровых компетенций, нарастающим итогом (d3)
4091;доля образовательных организаций, реализующих программы начального общего, основного общего, среднего общего и среднего профессионального образования, которым предоставлен онлайн-доступ к цифровым образовательным ресурсам и сервисам (d3)
4092;количество разработанных решений с внедрёнными механизмами криптографической защиты для использования в ключевых отраслях экономики (d4)
4093;количество отраслей экономики, для которых обеспечена отработка навыков противодействия компьютерным атакам с использованием цифровых двойников организаций (d4)
4094;протяженность создаваемых российских квантовых сетей связи (d5)
4095;количество кубитов в квантовом процессоре на отчетный год (d5)
4096;уровень локализации базовых станций для сетей связи 5g/imt-2020 российского производства (в стоимостном выражении) (d5)
4097;количество программных продуктов в реестре российских программ для электронных вычислительных машин и баз данных (d5)
4098;количество видов сведений, предоставляемых в режиме онлайн органами государственной власти в рамках межведомственного взаимодействия при предоставлении государственных услуг и исполнении функций, в том числе коммерческим организациям в соответствии с законодательством (d15)
4099;количество населенных пунктов с количеством жителей от 100 до 500 человек, на территориях которых домохозяйствам обеспечена возможность широкополосного доступа к информационно-телекоммуникационной сети 'интернет' (d2)
4100;объем радиочастотного спектра, доступного для использования радиоэлектронными средствами сетей 5g/imt-2020
4101;количество проектов по разработке и внедрению решений в сфере информационных технологий, реализуемых стартапами, получивших государственную поддержку (d5)
4102;доля зарегистрированных пользователей единого портала государственных и муниципальных услуг (функций) (епгу), использующих сервисы епгу в текущем году в электронном виде, от общего числа зарегистрированных пользователей епгу (d6)
4103;публикации российских специалистов на конференциях в области искусственного интеллекта уровня а* (d7)
4104;количество специалистов в области искусственного интеллекта, подготовленных в рамках программ высшего образования (d7)
4105;количество человек, получивших дополнительное профессиональное образование в области искусственного интеллекта и смежных областях с использованием механизма персональных цифровых сертификатов (d7)
4106;количество нормативных правовых актов и документов, принятых в рамках цифровой трансформации законодательства российской федерации (d1)
4107;количество талантливых школьников 8 - 11 классов, прошедших дополнительный двухлетний курс обучения современным языкам программирования
4108;количество созданных и запущенных на геостационарную и высокоэллиптические орбиты космических аппаратов обеспечения спутникового широкополосного доступа к информационно-телекоммуникационной сети 'интернет'
